{"event_id":"11111111-1111-4111-8111-111111111112","event_type":"access.revoke.request.v1","schema_version":1,"occurred_at":"2026-08-18T12:00:00Z","producer":"access-service","correlation_id":"22222222-2222-4222-8222-222222222222","causation_id":"33333333-3333-4333-8333-333333333334","aggregate_type":"credential","aggregate_id":"44444444-4444-4444-8444-444444444444","partition_key":"credential:44444444-4444-4444-8444-444444444444","data":{"operation_id":"55555555-5555-4555-8555-555555555556","credential_id":"44444444-4444-4444-8444-444444444444","desired_revision":2}}
